course_id,course_name,credits,hours,course_type,department,teachers,TAs
AI201,人工智能导论,2.0,32,学科基础,人工智能学院,,陈兰英、乐晨、邱建平、韩玉梅、赵莹、林雪梅、赵莹、吕帅、张秀荣、傅涛、张璐、陈淑珍、金秀芳、曹畅、闵晶、高想
AI202,概率图模型基础,2.0,32,学科基础,人工智能学院,,邓超、邱建平、高想、严玉梅、谢雪梅、金秀芳、王瑜、殷平、王瑜、严玉梅、乐晨、高想、金秀芳、陈淑珍、周桂英、高想
AI301,机器学习,3.0,48,专业必修,人工智能学院,,郝利、向荣、张秀荣、陈波、闵晶、王婷婷、王瑜、李淑英、闵晶、查冬梅、张秀荣、陈淑珍、王瑜、向玉梅、范燕、查冬梅
AI302,深度学习,3.0,48,专业必修,人工智能学院,,金秀芳、沈成、张桂英、林雪梅、刘畅、郝利、向荣、赵莹、邵琴、张辉、谢雪梅、崔琴、陈波、沈成、叶霞、周桂英
AI303,计算机视觉,3.0,48,专业选修,人工智能学院,,许淑兰、王婷、李淑英、王婷、陈兰英、陈桂荣、刘畅、邓超、王婷、陈淑珍、刘宇、林雪梅、黎金凤、邓超、刘畅、傅涛
AI304,自然语言处理,3.0,48,专业选修,人工智能学院,,张璐、钱平、宋霞、高想、曹畅、刘宇、范燕、郝利、张璐、乐晨、向荣、王婷婷、邵琴、陈成、张璐、李淑英
AI401,模式识别,3.0,48,专业必修,人工智能学院,,陈瑜、王瑜、李淑英、刘宇、陈成、王东、张璐、刘宇、范燕、宋霞、严玉梅、崔琴、邓超、严玉梅、乐晨、韩玉梅
AI402,强化学习,3.0,48,专业选修,人工智能学院,,范燕、严玉梅、朱秀芳、吕帅、张小红、李淑英、邓超、谢雪梅、韩玉梅、曹畅、陈波、王东、查冬梅、陈波、王婷、张小红
CM201,C语言程序设计,3.0,48,学科基础,计算机学院,,吴帅、杜想、陈俊、韦晨、杜想、吴敏、鲁秀兰、卢宇、李婷婷、崔桂香、张建平、金秀英、文宇、齐畅、齐畅、孙燕
CM202,C++程序设计基础,3.0,48,学科基础,计算机学院,,朱瑜、齐畅、金秀英、马莹、郭凤英、陈秀芳、文宇、卢宇、陈海燕、胡霞、朱瑜、孟琳、胡霞、张莹、陈磊、贺婷
CM203,Python程序设计基础,2.0,32,学科基础,计算机学院,,吴帅、邱娜、张慧、张兵、陈磊、齐畅、彭婷、孙燕、卢宇、孟琳、郭凤英、曾秀兰、彭婷、刘畅、何琴、刘桂珍
CM204,数据结构与算法设计,4.0,64,学科基础,计算机学院,,窦璐、杨玉梅、马莹、刘畅、朱瑜、李婷婷、曾秀兰、张建平、蔡玉兰、陆柳、朱瑜、耿春梅、窦璐、何琴、孟琳、马莹
CM205,离散数学,3.0,48,学科基础,计算机学院,,吴帅、彭婷、邱娜、陆柳、孙燕、吴帅、张莹、卢宇、陈秀芳、龚凯、文宇、金秀英、陈俊、贺婷、窦璐、史萍
CM206,计算机组成原理,3.0,48,学科基础,计算机学院,,陈磊、崔桂香、金秀英、邱娜、贺婷、徐建军、耿春梅、史萍、李婷婷、张建平、齐畅、耿春梅、李婷婷、秦萍、吴帅、卢宇
CM207,操作系统原理,3.0,48,学科基础,计算机学院,,秦萍、刘桂珍、林涛、徐建军、窦璐、杨春梅、龚凯、曾秀兰、曾秀兰、龚凯、邱娜、林涛、杨玉梅、彭婷、蔡玉兰、李娜
CM208,数据库系统基础,3.0,48,学科基础,计算机学院,,张莹、林涛、金秀英、杜想、张慧、郑文、刘桂珍、陈秀芳、杨春梅、王燕、孟琳、齐畅、陈秀芳、韦晨、吴帅、陈秀芳
CM209,计算机网络基础,3.5,56,学科基础,计算机学院,,李畅、孙燕、杨玉梅、何琴、文宇、龚凯、史萍、鲁秀兰、彭婷、蔡玉兰、孙燕、陈海燕、胡霞、林艳、李婷婷、陈海燕
CM210,软件工程导论,2.0,32,学科基础,计算机学院,,吴帅、吴敏、孟琳、卢宇、徐建军、王燕、马莹、林涛、龚凯、齐畅、林艳、金秀英、陈磊、陈俊、陆柳、史萍
CS301,数据库系统原理,3.0,48,专业必修,计算机学院,,陆柳、史萍、陆柳、孙燕、刘桂珍、鲁秀兰、王燕、林艳、齐畅、秦萍、姬洋、张慧、杨玉梅、窦璐、李婷婷、杨春梅
CS302,操作系统,4.0,64,专业必修,计算机学院,,邱娜、陆柳、林涛、王燕、张兵、朱瑜、陆柳、吴帅、张兵、陈俊、史萍、吴帅、林艳、刘畅、马莹、陈海燕
CS303,编译原理,3.0,48,专业必修,计算机学院,,王燕、吴帅、吴敏、朱瑜、陈洋、陈俊、刘畅、卢宇、邱娜、林艳、金秀英、陈洋、彭婷、卢宇、姬洋、徐建军
CS304,计算机体系结构,3.0,48,专业必修,计算机学院,,邱娜、曾秀兰、卢宇、王燕、蔡玉兰、林艳、秦萍、李娜、齐畅、刘畅、郑文、孙燕、郑文、窦璐、崔桂香、张建平
CS305,软件测试与质量保证,2.0,32,专业选修,计算机学院,,杜想、龚凯、何琴、杨春梅、陈海燕、史萍、刘畅、朱瑜、郭凤英、金秀英、蔡玉兰、马莹、张建平、秦萍、贺婷、李婷婷
CS306,Web应用开发,2.0,32,专业选修,计算机学院,,张建平、陈磊、吴敏、孙燕、蔡玉兰、史萍、窦璐、贺婷、耿春梅、胡霞、吴帅、张兵、陈洋、陈俊、郑文、胡霞
CS307,移动互联网开发,2.0,32,专业选修,计算机学院,,卢宇、吴敏、何琴、张兵、陆柳、王燕、郑文、秦萍、张兵、陈秀芳、王燕、秦萍、李婷婷、耿春梅、陆柳、卢宇
CS401,人工智能基础,3.0,48,专业选修,计算机学院,,朱瑜、李畅、郑文、李娜、杨春梅、曾秀兰、史萍、杨春梅、刘桂珍、蔡玉兰、孟琳、郑文、吴敏、郭凤英、陈秀芳、卢宇
CS402,大数据处理技术,3.0,48,专业选修,计算机学院,,陈秀芳、蔡玉兰、蔡玉兰、陈海燕、龚凯、林涛、贺婷、姬洋、杨玉梅、吴帅、张莹、金秀英、张莹、何琴、林涛、张建平
CS403,云计算与虚拟化,2.0,32,专业选修,计算机学院,,卢宇、杨春梅、韦晨、李畅、陈洋、陈海燕、林涛、胡霞、李畅、李婷婷、秦萍、彭婷、陈海燕、姬洋、孙燕、邱娜
EE201,电路原理,4.0,64,学科基础,电子工程学院,,汪冬梅、胡静、张玉珍、王玲、韩红霞、李婷、王玲、林龙、梁秀珍、程彬、王敏、李淑珍、梁刚、王雷、周玉珍、杨刚
EE202,模拟电子技术,4.0,64,学科基础,电子工程学院,,唐静、刘成、余璐、胡静、冯华、周桂芝、梁秀珍、谢楠、程彬、韩红霞、程彬、曹冬梅、王雷、胡静、杜秀兰、唐静
EE203,数字电子技术,4.0,64,学科基础,电子工程学院,,王玲、唐静、孙瑞、彭秀荣、邵帆、杜秀兰、梁丽、余梅、刘秀珍、周玉珍、邵晨、李婷、余梅、王龙、韩红霞、李婷
EE301,电磁场与电磁波,4.0,64,专业必修,电子工程学院,,韩红霞、邓丽丽、王敏、贾斌、雷婷、贾斌、王龙、孙瑞、杜秀兰、林龙、徐丽丽、雷婷、林龙、彭俊、王敏、彭秀荣
EE302,数字信号处理,3.0,48,专业必修,电子工程学院,,贾斌、余璐、姜秀梅、韩红霞、周桂芝、彭秀荣、杨刚、李淑珍、王敏、谢楠、彭秀荣、程彬、韦明、孙瑞、姜秀梅、邓丽丽
EE303,单片机原理与接口技术,3.0,48,专业必修,电子工程学院,,王雷、李淑珍、邓丽丽、谭彬、彭秀荣、冯华、韦明、谢楠、王杨、周玉珍、王杨、李淑珍、唐静、汪冬梅、彭俊、谭彬
EE304,嵌入式系统设计,3.0,48,专业选修,电子工程学院,,贾斌、彭俊、梁秀珍、邓丽丽、张秀兰、彭俊、彭秀荣、张玉珍、刘秀珍、王龙、张玉珍、王龙、刘淑英、梁丽、贾斌、刘成
EE401,射频电路设计,3.0,48,专业选修,电子工程学院,,马冬梅、邵帆、李淑珍、彭俊、程彬、李婷、王雷、杜秀兰、林龙、王杨、马冬梅、梁丽、王玲、邵晨、邵晨、汪冬梅
EE402,集成电路设计基础,3.0,48,专业选修,电子工程学院,,周宁、刘淑英、胡静、孙瑞、余梅、王杨、李平、唐静、李平、唐静、王敏、彭俊、周玉珍、冯华、安丹、王玲
EN101,大学英语1,3.0,48,公共必修,外语学院,,
EN102,大学英语2,3.0,48,公共必修,外语学院,,
EN103,大学英语3,2.0,32,公共必修,外语学院,,
EN104,大学英语4,2.0,32,公共必修,外语学院,,
GE101,艺术欣赏,2.0,32,通识选修,人文学院,,刘桂英、谢洁、龚凤兰、刘玲、朴建平、董婷、陈玉珍、李兵、王霞、刘玲、阎志强、马杰、李芳、吴凤兰、李丹丹、宋宇
GE102,经济学原理,2.0,32,通识选修,人文学院,,杨文、李芳、王宇、萧刚、许浩、李丹丹、姚凤英、王淑兰、夏玉华、谢洁、谢丹丹、廖欣、邓静、李兵、李丹丹、关强
GE103,摄影基础,2.0,32,通识选修,人文学院,,姚凤英、王霞、龚凤兰、杨利、姚凤英、廖欣、李丹丹、刘晶、李芳、谢丹丹、宋宇、马杰、王凤英、潘俊、萧刚、白勇
GE104,影视鉴赏,2.0,32,通识选修,人文学院,,王冬梅、孟梅、杨秀梅、李欣、刘桂英、杨秀梅、马杰、宋宇、潘俊、龚凤兰、常燕、孟文、邓静、刘桂英、王冬梅、李丹丹
GE105,管理学基础,2.0,32,通识选修,人文学院,,马杰、林丽丽、潘俊、卢辉、孟文、方飞、孟梅、李欣、耿岩、叶建平、龚凤兰、杨秀梅、萧刚、李兵、何涛、杨秀梅
GE106,心理学导论,2.0,32,通识选修,人文学院,,符鑫、廖欣、董婷、刘晶、符鑫、何涛、孟梅、马杰、耿岩、萧刚、朴建平、李欣、关强、邓静、何涛、马杰
GE107,统计学基础,2.0,32,通识选修,人文学院,,李雪梅、王柳、萧刚、王玉华、张玲、陈玉珍、方飞、王淑兰、王冬梅、龚凤兰、廖欣、王柳、王玉华、李雪梅、李兵、马杰
GE108,哲学与人生,2.0,32,通识选修,人文学院,,王宇、姚凤英、刘晶、叶建平、王霞、龚凤兰、罗秀兰、耿岩、关强、孟梅、朴建平、卢辉、王宇、朴建平、谢丹丹、谢洁
GE109,逻辑思维训练,2.0,32,通识选修,人文学院,,陈玉珍、潘俊、常燕、李芳、王冬梅、林芳、宋宇、王凤英、刘玲、李雪梅、叶建平、常燕、李雪梅、王玉华、杨秀梅、萧刚
GE110,创新创业基础,2.0,32,通识选修,人文学院,,刘玲、宋宇、刘彬、罗秀兰、邓静、萧刚、白勇、朴建平、姚凤英、符鑫、王玉华、王柳、林芳、刘桂英、杨秀梅、贺彬
GE111,书法艺术,2.0,32,通识选修,人文学院,,许浩、邓静、李芳、关强、李雪梅、姚凤英、廖欣、向文、王淑兰、常燕、萧刚、李丹丹、方飞、李丹丹、吴凤兰、孟文
GE112,音乐鉴赏,2.0,32,通识选修,人文学院,,刘玲、王冬梅、王柳、刘桂英、叶建平、王宇、顾玉、阎志强、林芳、白勇、杨文、谢洁、王霞、王玉华、张玲、常燕
GE113,世界文明史,2.0,32,通识选修,人文学院,,关强、谢洁、马杰、刘晶、孟文、杨秀梅、李雪梅、李芳、阎志强、刘玲、谢洁、李雪梅、方飞、卢辉、李欣、罗建平
GE114,环境与可持续发展,2.0,32,通识选修,人文学院,,卢辉、夏玉华、刘桂英、王淑兰、向文、夏玉华、罗秀兰、马杰、方飞、宋宇、张玲、李雪梅、王宇、陈俊、王玉华、张玲
GE115,法律基础与法治思维,2.0,32,通识选修,人文学院,,徐建国、王淑兰、杨利、白勇、王淑兰、向文、吴凤兰、萧刚、卢辉、谢洁、杨文、董婷、李欣、白勇、邓静、卢辉
GE116,公共演讲与表达,2.0,32,通识选修,人文学院,,朴建平、廖欣、刘桂英、顾玉、向文、许浩、姚凤英、李丹丹、孟文、姚凤英、陈俊、徐建国、卢辉、廖欣、陈俊、刘彬
GE117,职业生涯规划,2.0,32,通识选修,人文学院,,王柳、刘桂英、阎志强、李欣、王淑兰、罗秀兰、许浩、杨文、关强、王玉华、杨利、王淑兰、李雪梅、萧刚、夏玉华、贺彬
GE118,项目管理基础,2.0,32,通识选修,人文学院,,张玲、方飞、陈俊、潘俊、方飞、宋宇、谢洁、陈玉珍、陈玉珍、王宇、李芳、陈俊、常燕、孟文、谢丹丹、李雪梅
GE119,城市与社会发展,2.0,32,通识选修,人文学院,,董婷、徐建国、王玉华、陈玉珍、王玉华、萧刚、谢洁、徐建国、孟文、马杰、白勇、杨利、吴凤兰、姚凤英、孟文、林丽丽
GE120,人工智能与社会,2.0,32,通识选修,人文学院,,李雪梅、杨秀梅、李芳、林芳、孟梅、罗秀兰、方飞、符鑫、王宇、罗建平、关强、张玲、宋宇、刘彬、李欣、林丽丽
HX101,中国近现代史纲要,2.0,32,公共必修,马克思主义学院,,
IC201,学术英语写作,3.0,48,学科基础,国际学院,,史萍、叶霞、高想、崔琴、陈秀芳、周桂英、朱瑜、邓超、崔琴、王婷婷、张小红、李畅、彭婷、陈成、杨玉梅、崔琴
IC202,产品开发与项目管理,2.0,32,学科基础,国际学院,,彭婷、金秀英、高想、崔琴、张秀荣、刘宇、田浩、叶霞、李娜、王瑜、秦萍、李娜、林艳、闵晶、朱瑜、范燕
IC301,人工智能法律,2.0,32,专业选修,国际学院,,彭婷、李娜、文宇、胡霞、邱娜、郑文、张小红、姬洋、徐建军、贺婷、陈淑珍、傅涛、张兵、乐晨、邓超、朱秀芳
MA101,高等数学A(上),4.0,64,公共必修,理学院,,
MA102,高等数学A(下),4.0,64,公共必修,理学院,,
MA201,线性代数,3.0,48,公共必修,理学院,,
MA202,概率论与数理统计,3.0,48,公共必修,理学院,,
ML101,军事理论,2.0,32,公共必修,军训教研部,,
MP201,管理学原理,3.0,48,学科基础,现代邮政学院,,杨凤兰、孙婷婷、尹秀芳、韩想、陈英、杨凤兰、陈英、李莹、章飞、邵鑫、王磊、陈英、唐红、陈春梅、邓雪梅、杨凤兰
MP202,运筹学基础,3.0,48,学科基础,现代邮政学院,,许莹、莫俊、战畅、戴玉珍、章飞、战畅、张秀荣、杨凤兰、王萍、韩想、邓雪梅、杨凤兰、邵鑫、周玉梅、许莹、刘荣
MP301,现代物流学,3.0,48,专业必修,现代邮政学院,,张秀荣、杨凤兰、周玉梅、冯海燕、邓丹丹、李莹、陈英、战畅、周玉梅、甘军、李帆、王萍、张宁、王磊、胡秀云、韩想
MP302,供应链管理,3.0,48,专业必修,现代邮政学院,,刘柳、甘军、戴玉珍、唐红、王兵、张宁、李帆、郭华、王兵、胡秀云、刘亮、莫俊、胡红霞、孙婷婷、章飞、胡秀云
MP303,电子商务概论,2.0,32,专业选修,现代邮政学院,,孙婷婷、刘柳、陈英、战畅、王凤兰、张梅、章飞、王磊、郭华、邓雪梅、章飞、刘柳、王萍、许莹、袁璐、王凤兰
MP401,快递服务管理,3.0,48,专业选修,现代邮政学院,,陈英、邓雪梅、戴玉珍、莫俊、王磊、张梅、张梅、戎瑞、韩想、袁璐、段英、王兵、陈春梅、汪杰、胡荣、邓丹丹
MP402,物流系统规划与设计,3.0,48,专业选修,现代邮政学院,,胡秀云、胡荣、莫俊、刘荣、郭华、刘柳、戴玉珍、孙婷婷、周琴、张宁、冯海燕、段英、刘荣、尹秀芳、唐红、胡荣
PE101,大学体育1,1.0,32,公共必修,体育部,,
PE102,大学体育2,1.0,32,公共必修,体育部,,
PE103,大学体育3,0.5,16,公共必修,体育部,,
PE104,大学体育4,0.5,16,公共必修,体育部,,
PH101,大学物理A(上),3.5,56,公共必修,理学院,,
PH102,大学物理A(下),3.5,56,公共必修,理学院,,
SC201,密码学基础,3.0,48,学科基础,网络空间安全学院,,
SC202,安全数学基础,3.0,48,学科基础,网络空间安全学院,,
SC301,网络安全技术,3.0,48,专业必修,网络空间安全学院,,
SC302,操作系统安全,2.0,32,专业选修,网络空间安全学院,,
SC303,Web安全,2.0,32,专业选修,网络空间安全学院,,
SC304,恶意代码分析,2.0,32,专业选修,网络空间安全学院,,
SC401,密码学,3.0,48,专业必修,网络空间安全学院,,
SC402,安全攻防实践,3.0,48,专业选修,网络空间安全学院,,
SE401,软件工程实践,3.0,48,专业必修,计算机学院,,张兵、马莹、杨玉梅、史萍、孙燕、陈海燕、姬洋、曾秀兰、崔桂香、陈洋、何琴、张建平、杨春梅、蔡玉兰、朱瑜、鲁秀兰
SE402,需求工程,2.0,32,专业必修,计算机学院,,窦璐、史萍、崔桂香、韦晨、文宇、陈秀芳、陈俊、王燕、马莹、郑文、姬洋、蔡玉兰、蔡玉兰、杨玉梅、韦晨、彭婷
SE403,软件项目管理,2.0,32,专业选修,计算机学院,,车荣、张莹、齐畅、林涛、徐建军、郭凤英、刘桂珍、耿春梅、崔桂香、蔡玉兰、张建平、陈洋、邱娜、蔡玉兰、刘桂珍、邱娜
TC201,电路分析基础,4.0,64,学科基础,信息与通信工程学院,,刘凤英、李秀梅、王彬、张宁、梁琳、朱宁、秦龙、何磊、许龙、高荣、阎健、李秀梅、张桂花、王敏、王帆、朱宁
TC202,模拟电子技术基础,4.0,64,学科基础,信息与通信工程学院,,邹磊、曹淑英、林秀兰、王彬、高荣、梁琳、梁琳、诸兵、王敏、秦龙、简军、赵斌、王敏、梁琳、张桂花、许龙
TC203,数字电子技术基础,4.0,64,学科基础,信息与通信工程学院,,张宁、梁琳、何磊、金秀荣、苏勇、赵秀英、王彬、文英、夏春梅、郑斌、王丽华、陈玉、朱宁、赵斌、冯丹丹、金秀荣
TC301,信号与系统,4.0,64,专业必修,信息与通信工程学院,,夏春梅、郑斌、邹磊、陈丹丹、邹磊、何磊、曹淑英、张桂花、刘凤英、张欢、文英、诸兵、张鹏、何磊、高荣、陈玉
TC302,通信原理,4.0,64,专业必修,信息与通信工程学院,,郑斌、邹磊、朱宁、金秀荣、梁琳、何磊、王丽华、崔华、王萍、张宁、刘秀华、张鹏、秦龙、林秀兰、刘凤英、简军
TC303,信息论与编码,3.0,48,专业必修,信息与通信工程学院,,梁琳、王萍、秦龙、阎健、冯丹丹、马倩、赵秀英、邹磊、冯丹丹、王帆、陈丹丹、李桂兰、金秀荣、朱宁、陈丹丹、赵秀英
TC401,移动通信原理,3.0,48,专业必修,信息与通信工程学院,,夏春梅、郑斌、高荣、张鹏、朱宁、陈玉、黄强、秦龙、朱霞、陈玉、刘秀华、萧秀英、高荣、王丽华、陶桂香、朱霞
TC402,数字通信系统,3.0,48,专业选修,信息与通信工程学院,,王帆、张鹏、赵秀英、张欢、马倩、何磊、张宁、曹淑英、赵斌、何磊、王帆、朱霞、高荣、王丽华、诸兵、刘秀华
TC403,光纤通信技术,2.0,32,专业选修,信息与通信工程学院,,曹淑英、刘凤英、李桂兰、邵婷婷、文英、冀英、梁琳、陈玉、陈丹丹、邵婷婷、简军、王丽华、梁琳、曹淑英、刘凤英、萧秀英
XL101,大学生心理健康教育,2.0,32,公共必修,学生工作部,,
YW101,大学语文,2.0,32,公共必修,人文学院,,廖欣、刘彬、姚凤英、刘晶、萧刚、林芳、陈玉珍、龚凤兰、耿岩、朴建平、罗秀兰、阎志强、谢丹丹、李兵、王霞、夏玉华
ZX101,思想道德与法治,3.0,48,公共必修,马克思主义学院,,
ZX102,马克思主义基本原理,3.0,48,公共必修,马克思主义学院,,
ZX103,毛泽东思想和中国特色社会主义理论体系概论,4.0,64,公共必修,马克思主义学院,,
